{
  "kind": "ruling",
  "id": "R-4",
  "created": "2026-09-26T10:05Z",
  "updated": "2026-09-26T10:05Z",
  "about": "Should checkout retry ship with the retry wait differing from the spec?",
  "said": "Fix the constant first; I don't want the spec to be wrong on release day.",
  "source": "chat, 2026-09-26",
  "entries": ["Q-7"],
  "status": "active"
}
